{
  "format": "odin-delivery",
  "version": 1,
  "repo": "odin-labs-ai/odin-rnd",
  "window": {
    "fromPr": 71,
    "toPr": 97,
    "otherNumbers": []
  },
  "generatedFrom": {
    "tool": "delivery-record-export",
    "toolVersion": 1,
    "window": {
      "fromPr": 71,
      "toPr": 97,
      "otherNumbers": []
    },
    "latestPr": 97,
    "ghFetchedAt": "2026-10-26T04:55:05Z",
    "verdictRowsRead": 62
  },
  "prs": [
    71,
    72,
    73,
    74,
    75,
    76,
    77,
    78,
    79,
    80,
    81,
    82,
    83,
    84,
    85,
    86,
    87,
    88,
    89,
    90,
    91,
    92,
    93,
    94,
    95,
    96,
    97
  ],
  "records": [
    {
      "id": "pr-71",
      "kind": "pr",
      "pr": 71,
      "at": "2026-10-24T23:16:51Z",
      "repo": "odin-labs-ai/odin-rnd",
      "ref": "c61045b29593f5dc52a7452ca392751f993ed7e9",
      "state": "merged",
      "source": "https://github.com/odin-labs-ai/odin-rnd/pull/71",
      "title": "feat(site): agent space, experiment rows and boundary bench read human-first"
    },
    {
      "id": "pr-71/review/7910350e-37cd-4068-91a7-d96c9a68f50a",
      "kind": "review",
      "pr": 71,
      "at": "2026-10-24T23:24:17Z",
      "repo": "odin-labs-ai/odin-rnd",
      "ref": "32075bbd403ef9d73084645b270862cf2491f165",
      "state": "FIX-NEEDED",
      "source": "verdict-row:7910350e-37cd-4068-91a7-d96c9a68f50a",
      "reviewer": "automated"
    },
    {
      "id": "pr-71/review/18d10802-2b03-49f7-acaf-75bb72816fc7",
      "kind": "review",
      "pr": 71,
      "at": "2026-10-24T23:31:32Z",
      "repo": "odin-labs-ai/odin-rnd",
      "ref": "c61045b29593f5dc52a7452ca392751f993ed7e9",
      "state": "SHIP",
      "source": "verdict-row:18d10802-2b03-49f7-acaf-75bb72816fc7",
      "reviewer": "automated"
    },
    {
      "id": "pr-71/ci/40142763122/1",
      "kind": "ci",
      "pr": 71,
      "at": "2026-10-24T23:26:45Z",
      "repo": "odin-labs-ai/odin-rnd",
      "ref": "c61045b29593f5dc52a7452ca392751f993ed7e9",
      "state": "success",
      "source": "https://github.com/odin-labs-ai/odin-rnd/actions/runs/40142763122/attempts/1",
      "workflow": "Public experiments & Pages",
      "attempt": 1
    },
    {
      "id": "pr-71/ci/40142761457/1",
      "kind": "ci",
      "pr": 71,
      "at": "2026-10-24T23:26:43Z",
      "repo": "odin-labs-ai/odin-rnd",
      "ref": "c61045b29593f5dc52a7452ca392751f993ed7e9",
      "state": "success",
      "source": "https://github.com/odin-labs-ai/odin-rnd/actions/runs/40142761457/attempts/1",
      "workflow": "CodeQL",
      "attempt": 1
    },
    {
      "id": "pr-71/ci/40142085258/1",
      "kind": "ci",
      "pr": 71,
      "at": "2026-10-24T23:16:54Z",
      "repo": "odin-labs-ai/odin-rnd",
      "ref": "32075bbd403ef9d73084645b270862cf2491f165",
      "state": "success",
      "source": "https://github.com/odin-labs-ai/odin-rnd/actions/runs/40142085258/attempts/1",
      "workflow": "Public experiments & Pages",
      "attempt": 1
    },
    {
      "id": "pr-71/ci/40142083383/1",
      "kind": "ci",
      "pr": 71,
      "at": "2026-10-24T23:16:53Z",
      "repo": "odin-labs-ai/odin-rnd",
      "ref": "32075bbd403ef9d73084645b270862cf2491f165",
      "state": "success",
      "source": "https://github.com/odin-labs-ai/odin-rnd/actions/runs/40142083383/attempts/1",
      "workflow": "CodeQL",
      "attempt": 1
    },
    {
      "id": "pr-71/landing",
      "kind": "landing",
      "pr": 71,
      "at": "2026-10-24T23:35:52Z",
      "repo": "odin-labs-ai/odin-rnd",
      "ref": "a6b90ba3fb828bc3aedf1e4f2f671dbb543b2db0",
      "state": "merged",
      "source": "https://github.com/odin-labs-ai/odin-rnd/commit/a6b90ba3fb828bc3aedf1e4f2f671dbb543b2db0"
    },
    {
      "id": "pr-71/deploy/40143388941",
      "kind": "deploy",
      "pr": 71,
      "at": "2026-10-24T23:41:48Z",
      "repo": "odin-labs-ai/odin-rnd",
      "ref": "a6b90ba3fb828bc3aedf1e4f2f671dbb543b2db0",
      "state": "success",
      "source": "https://github.com/odin-labs-ai/odin-rnd/actions/runs/40143388941"
    },
    {
      "id": "pr-72",
      "kind": "pr",
      "pr": 72,
      "at": "2026-10-25T02:00:44Z",
      "repo": "odin-labs-ai/odin-rnd",
      "ref": "8bec7cb44a940fbbe8efceaa950e7efb8841f086",
      "state": "merged",
      "source": "https://github.com/odin-labs-ai/odin-rnd/pull/72",
      "title": "fix(journal): the MongoDB note's headline states its scope"
    },
    {
      "id": "pr-72/review/f2f69c04-7efb-4684-a3e5-113d1c26db0b",
      "kind": "review",
      "pr": 72,
      "at": "2026-10-25T02:03:42Z",
      "repo": "odin-labs-ai/odin-rnd",
      "ref": "a7d3a0b262da8620a88768292671aabdc1b13ad5",
      "state": "FIX-NEEDED",
      "source": "verdict-row:f2f69c04-7efb-4684-a3e5-113d1c26db0b",
      "reviewer": "automated"
    },
    {
      "id": "pr-72/review/c0a1bdac-40c3-4e5e-b3f8-cf33a85829f3",
      "kind": "review",
      "pr": 72,
      "at": "2026-10-25T02:05:13Z",
      "repo": "odin-labs-ai/odin-rnd",
      "ref": "8bec7cb44a940fbbe8efceaa950e7efb8841f086",
      "state": "SHIP",
      "source": "verdict-row:c0a1bdac-40c3-4e5e-b3f8-cf33a85829f3",
      "reviewer": "automated"
    },
    {
      "id": "pr-72/ci/40153042922/1",
      "kind": "ci",
      "pr": 72,
      "at": "2026-10-25T02:04:16Z",
      "repo": "odin-labs-ai/odin-rnd",
      "ref": "8bec7cb44a940fbbe8efceaa950e7efb8841f086",
      "state": "success",
      "source": "https://github.com/odin-labs-ai/odin-rnd/actions/runs/40153042922/attempts/1",
      "workflow": "Public experiments & Pages",
      "attempt": 1
    },
    {
      "id": "pr-72/ci/40153040978/1",
      "kind": "ci",
      "pr": 72,
      "at": "2026-10-25T02:04:14Z",
      "repo": "odin-labs-ai/odin-rnd",
      "ref": "8bec7cb44a940fbbe8efceaa950e7efb8841f086",
      "state": "success",
      "source": "https://github.com/odin-labs-ai/odin-rnd/actions/runs/40153040978/attempts/1",
      "workflow": "CodeQL",
      "attempt": 1
    },
    {
      "id": "pr-72/ci/40152822415/1",
      "kind": "ci",
      "pr": 72,
      "at": "2026-10-25T02:00:47Z",
      "repo": "odin-labs-ai/odin-rnd",
      "ref": "a7d3a0b262da8620a88768292671aabdc1b13ad5",
      "state": "failure",
      "source": "https://github.com/odin-labs-ai/odin-rnd/actions/runs/40152822415/attempts/1",
      "workflow": "Public experiments & Pages",
      "attempt": 1
    },
    {
      "id": "pr-72/ci/40152821279/1",
      "kind": "ci",
      "pr": 72,
      "at": "2026-10-25T02:00:46Z",
      "repo": "odin-labs-ai/odin-rnd",
      "ref": "a7d3a0b262da8620a88768292671aabdc1b13ad5",
      "state": "success",
      "source": "https://github.com/odin-labs-ai/odin-rnd/actions/runs/40152821279/attempts/1",
      "workflow": "CodeQL",
      "attempt": 1
    },
    {
      "id": "pr-72/landing",
      "kind": "landing",
      "pr": 72,
      "at": "2026-10-25T02:14:35Z",
      "repo": "odin-labs-ai/odin-rnd",
      "ref": "e3f103ecb9828eb0102b3f4548105fd04f560e50",
      "state": "merged",
      "source": "https://github.com/odin-labs-ai/odin-rnd/commit/e3f103ecb9828eb0102b3f4548105fd04f560e50"
    },
    {
      "id": "pr-72/deploy/40153707728",
      "kind": "deploy",
      "pr": 72,
      "at": "2026-10-25T02:22:37Z",
      "repo": "odin-labs-ai/odin-rnd",
      "ref": "e3f103ecb9828eb0102b3f4548105fd04f560e50",
      "state": "success",
      "source": "https://github.com/odin-labs-ai/odin-rnd/actions/runs/40153707728"
    },
    {
      "id": "pr-73",
      "kind": "pr",
      "pr": 73,
      "at": "2026-10-25T02:16:22Z",
      "repo": "odin-labs-ai/odin-rnd",
      "ref": "70fee21ceb79a5edb219aa4f732b1683d612210e",
      "state": "merged",
      "source": "https://github.com/odin-labs-ai/odin-rnd/pull/73",
      "title": "feat(site): the whole R&D home reads human-first; benches move to /experiments/"
    },
    {
      "id": "pr-73/review/62ce9b7c-8b02-4ac7-9a2f-72a82a8a2227",
      "kind": "review",
      "pr": 73,
      "at": "2026-10-25T02:23:30Z",
      "repo": "odin-labs-ai/odin-rnd",
      "ref": "7f17cb8a783668228ce0b806a7ed81705c6b1c3e",
      "state": "FIX-NEEDED",
      "source": "verdict-row:62ce9b7c-8b02-4ac7-9a2f-72a82a8a2227",
      "reviewer": "automated"
    },
    {
      "id": "pr-73/review/68e1ad57-ada7-4c62-960a-cdffab22e3c9",
      "kind": "review",
      "pr": 73,
      "at": "2026-10-25T02:54:25Z",
      "repo": "odin-labs-ai/odin-rnd",
      "ref": "18d407c98afc22a5fc574214180e0715c10c7c48",
      "state": "FIX-NEEDED",
      "source": "verdict-row:68e1ad57-ada7-4c62-960a-cdffab22e3c9",
      "reviewer": "automated"
    },
    {
      "id": "pr-73/review/6a3cb646-5eba-4f34-8350-fa22ee2000d3",
      "kind": "review",
      "pr": 73,
      "at": "2026-10-25T03:05:54Z",
      "repo": "odin-labs-ai/odin-rnd",
      "ref": "70fee21ceb79a5edb219aa4f732b1683d612210e",
      "state": "SHIP",
      "source": "verdict-row:6a3cb646-5eba-4f34-8350-fa22ee2000d3",
      "reviewer": "automated"
    },
    {
      "id": "pr-73/ci/40156505300/1",
      "kind": "ci",
      "pr": 73,
      "at": "2026-10-25T02:59:06Z",
      "repo": "odin-labs-ai/odin-rnd",
      "ref": "70fee21ceb79a5edb219aa4f732b1683d612210e",
      "state": "success",
      "source": "https://github.com/odin-labs-ai/odin-rnd/actions/runs/40156505300/attempts/1",
      "workflow": "Public experiments & Pages",
      "attempt": 1
    },
    {
      "id": "pr-73/ci/40156503128/1",
      "kind": "ci",
      "pr": 73,
      "at": "2026-10-25T02:59:03Z",
      "repo": "odin-labs-ai/odin-rnd",
      "ref": "70fee21ceb79a5edb219aa4f732b1683d612210e",
      "state": "success",
      "source": "https://github.com/odin-labs-ai/odin-rnd/actions/runs/40156503128/attempts/1",
      "workflow": "CodeQL",
      "attempt": 1
    },
    {
      "id": "pr-73/ci/40155825448/1",
      "kind": "ci",
      "pr": 73,
      "at": "2026-10-25T02:48:02Z",
      "repo": "odin-labs-ai/odin-rnd",
      "ref": "18d407c98afc22a5fc574214180e0715c10c7c48",